<?xml version="1.0"?>

<rules xmlns:xsd="http://www.w3.org/2001/XMLSchema-instance"
       xsd:noNamespaceSchemaLocation="firewall_rules.xsd">

    <!--Zero or more repetitions:-->
    <rule ruleID="201">
        <priority>201</priority>
        <IPsrc>string</IPsrc>
        <Psrc>string</Psrc>
        <IPdst>string</IPdst>
        <Pdst>string</Pdst>
        <Protocol>string</Protocol>
        <Action>DENY</Action>
    </rule>
    <rule ruleID="202">
        <priority>201</priority>
        <IPsrc>string</IPsrc>
        <Psrc>string</Psrc>
        <IPdst>string</IPdst>
        <Pdst>string</Pdst>
        <Protocol>string</Protocol>
        <Action>DENY</Action>
    </rule>
    <rule ruleID="203">
        <priority>201</priority>
        <IPsrc>string</IPsrc>
        <Psrc>string</Psrc>
        <IPdst>string</IPdst>
        <Pdst>string</Pdst>
        <Protocol>string</Protocol>
        <Action>DENY</Action>
    </rule>
    <rule ruleID="204">
        <priority>201</priority>
        <IPsrc>string</IPsrc>
        <Psrc>string</Psrc>
        <IPdst>string</IPdst>
        <Pdst>string</Pdst>
        <Protocol>string</Protocol>
        <Action>DENY</Action>
    </rule>

</rules>